{
  "schemaVersion": 1,
  "revision": 1,
  "show": "true",
  "bones": [
    { "id": "root", "parent": null, "rest": { "translation": [0, 0, 0], "rotation": [0, 0, 0], "scale": [1, 1, 1] } },
    { "id": "lid", "parent": "root", "rest": { "translation": [0, 0.9, -0.45], "rotation": [0, 0, 0], "scale": [1, 1, 1] } }
  ],
  "parts": [
    { "id": "base", "bone": "root", "type": "block", "block": "minecraft:chiseled_stone_bricks", "transform": { "translation": [-0.5, 0, -0.5], "scale": [1, 0.9, 1] }, "brightness": 15 },
    { "id": "lidPart", "bone": "lid", "type": "item", "item": { "type": "item", "item": "minecraft:oak_trapdoor" }, "transform": { "translation": [0, 0, 0.45], "scale": [1, 0.1, 1] } },
    { "id": "label", "bone": "root", "type": "text", "text": "&6{{ rig.state }}", "transform": { "translation": [0, 1.4, 0] }, "billboard": "vertical" }
  ],
  "clips": { "idle": "breathe", "open": { "motion": "spin", "loop": "once" } },
  "graph": {
    "initial": "idle",
    "states": { "idle": { "clip": "idle" }, "open": { "clip": "open", "then": "idle" } },
    "transitions": [
      { "from": "idle", "to": "open", "when": "rig.var.opened == true" },
      { "from": "open", "to": "idle", "when": "rig.var.opened == false" }
    ]
  },
  "hitboxes": [
    { "part": "base", "size": [1, 1, 1], "actions": [
      { "type": "setRig", "var": "opened", "value": "rig.var.opened != true", "trigger": "right_click" }
    ] }
  ],
  "lod": { "reducedAt": 32, "minimalAt": 64, "cullAt": 96, "minimalPart": "base" },
  "audience": { "when": "true" }
}
